potage de ble  corn soup,	soups	vegetables	french can	armstrong,water milk corn_kernels fresh frozen may_be used out_of season salt butter celery chopped onion chopped leek chopped white_part only flour whipping_cream salt ground_black pepper,1
pouding renverse des bluets blueberry upside down pudding,	desserts	puddings	berries	french can	armstrong,blueberries fresh blueberries individually frozen unsweetened sugar granulated lemon_rind grated flour all_purpose baking_powder salt shortening egg beaten vanilla milk whipped_cream ice_cream opt,1
pumpkin potatoes,	vegetables	french can	benoit,pumpkin equal_parts peeled potatoes peeled onion finely_chopped butter bacon salt pepper_to taste,1
quebec poached salmon,	seafood	french can	benoit,salmon_steaks oil salad lemon_juice from lemon lemon_peel from lemon salt onion smallquartered parsley_sprigs peppercornscrushed with back_of spoon green onion_tops,1
soupe aux pois beauceons pea soup beauce style,	soups	french can	armstrong,dried white pea_beans butter onion chopped leek chopped white_part only smoked_ham plus ham_bone _lb salt pork garlic_clove cold_water salted_herbs rinsed cold_water,1
sugar pie hotel paulin,	pies	french can,pastry_for pie brown_sugar packed flour all_purpose salt pinch eggs egg_yolk milk vanilla,1
tetes de violon a lail garlic-flavoured fiddleheads,	vegetables	french can	armstrong,fiddleheads fresh frozen fiddleheads butter garlic_cloves finely_chopped shallots finely_chopped soya_sauce sugar granulated white_wine,1
tourtiere,	meats	holiday	french can,flour baking_powder salt _lb shortening hot_water lemon_juice egg well_beaten pork lean_ground onion finely_chopped salt pepper thyme sage dry_mustard cloves potato boiled mashed celery_stalk minced consomme sage thyme butter flour parsley mushrooms chopped,1
tourtiere de quebec quebec pork pie,	french can	meats	armstrong,ground pork cup cold_water onion finely_chopped celery finely_chopped ground_black pepper bay_leaf dried savoury dried_rosemary grated_nutmeg pinch cinnamon salt oldfashioned_rolled oats pastry_for double_crust pie,1
pot au feu,	beef	french,boneless_rump roast stuck wilh whole_cloves peeled onions halved scraped parsnips pork lenderloin oplional stalks_celery cut_in inch_pieces chicken_breasts beef_bouillon _lb polish_sausage cut_up browned_and drained carrots scraped_and cut_in inch_pieces,1
tourtiere,	meats	holiday	french can	my,flour baking_powder salt _lb shortening hot_water lemon_juice egg well_beaten pork lean_ground onion finely_chopped salt pepper thyme sage dry_mustard cloves potato boiled mashed celery_stalk minced consomme sage thyme butter flour parsley mushrooms chopped,1
christmas oyster soup soupe aux huitres de noel,	soups	french can	holiday	my,carrots mediun peeled grated long thin_shreds celery finely_diced butter melted milk milk cream oysters salt and pepper_to taste,1
leftover turkey or chicken hash,	poultry	french can	leftovers	my,butter melted chicken fat up_to onion thinly_sliced celery diced turkey cooked diced up_to cups turkey chicken fat i_would use butter flour water savory salt pepper cream flour all_purpose baking_powder salt cream eggs beaten,1
french onion soup croutons,	soups/stews	appetizers	londontowne	beef	french,medium_onions kitchen_bouquet chicken_boullion cubes beef_bouillion cubes water,1
boudin blanc i sausage-making cookbook     french,	pork/ham	french	sausages,pork_butt fine ground quatreepices chicken_breast fine ground eggs salt rice flour white pepper milk,1
snails bourguignonne / escargots a la bourguignonne,	appetizers	french,large_paris mushrooms canned burgundy_snails salt and pepper snail_butter oil,1
snail fritters / beignets descargots,	appetizers	french,canned cooked snails olive_oil oil_for frying salt and pepper parsley_sprigs to_garnish olive_oil eggs separated herbs flour,1
snails cauderan / escargots a la cauderan,	appetizers	french,lard chicken_stock raw country_ham salt and pepper shallots bouquet_garni fresh white_breadcrumbs petitsgris_snails dry_white bordeaux,1
snails menetrel / escargots a la menetrel,	appetizers	french,butter pepper parsley chopped quatreepices crushed garlic canned_snails shallots chopped white_wine optional canned_anchovy fillets fresh white_breadcrumbs salt,1
french pear pie,	desserts	fruits	pies	french,bartlett_pears lemon_rind orange_juice frozen conc unbaked_inch pie_shell unbleached_flour ginger ground sugar salt cinnamon ground butter_or regular_margarine,1
french onion soup,	soups/stews	beef	french,butter medium cooking onion sliced sugar all_purpose flour dry_white wine beef_broth pepper day_old french_bread grated_swiss cheese grated parasean cheese paprika,1
french cheesecake,	cheese/eggs	cheesecakes	french,shortbread see_recipe cream_cheese _lb french cheese sugar granulated unbleached_flour eggs large separated sour_cream heavy_cream real vanilla_extract confectioners sugar,1
cinnamon french toast,	breads	cheese/eggs	french	breakfast,lge egg beaten cup milk tsp vanilla_extract,1
escargots on mushroom caps,	appetizers	french,snails vegetable seasoning bay_leaf butter white_wine finely_chopped parsley chopped onion minced green_onions cloves_garlic crushed nutmeg dash allspice mushroom_caps soy_sauce,1
impossible french apple pie,	pies	french,apples tart sliced pared margarine butter softened cinnamon ground eggs nutmeg ground sugar milk bisquick baking_mix bisquick baking_mix brown_sugar packed nuts chopped margarine butter firm,1
quick sourdough french bread,	breads	french,bread_flour sour_cream room_temp wheat_germ vinegar sugar egg_white salt water ginger poppy_seeds fastacting dry_yeast,1
french bread i,	breads	french,envelope_dry yeast salt warm_water f_to cornmeal about unbleached egg_white beaten with tbs allpurpose_flour water glaze,1
processor french bread,	breads	french,warm_water flour active_dry yeast salt sugar sugar allpurpose unbleached warm_water,1
lemon french toast,	cheese/eggs	breads	french	breakfast,loaf_frozen french_bread eggs dough frozen white grated_lemon peel use bread_dough fresh please flour lemon extract sugar milk salt melted_butter or_margarine,1
french bread ii,	breads	french,sifted_flour active_dry yeast sugar very_warm water salt egg_white unbeaten,1
french onion soup coca-cola,	soups/stews	beef	french,butter_or margarine vinegar onions thinly_sliced pepper beef_broth french_bread cut_into bouillon thick_slices cocacola parmesan_cheese grated salt,1
french rib steak marrow red wine sauce,	beef	french	sauces,marrow from beef_bones butter rib steaks about lbs finely_chopped shallots salt to_taste dry red_wine fresh ground pepper red_wine vinegar corn peanut vegetable sugar oil fresh canned beef_broth,1
french chicken w/roquefort garlic,	poultry	garlic	french,pieces skinned chicken whole garlic_cloves garlic puree cream sour_cream wedge roquefort_cheese olive_oil as_needed strips bacon liquor onion sliced salt pepper_to taste,1
french dressing,	dressings	french,ketchup vinegar red_wine sugar salt oil paprika onion grated garlic salt,1
