absolutely apricot,	abm	fruits	misc,yeast active_dry bread_flour dry milk salt butter apricot_jam dried_apricots chopped water,0
absolutely deep dark chocolate fudge cookies,	biscuits,stephen_ceideburg unsweetened_cocoa allpurpose_flour baking_soda salt semisweet baking chocolate broken unsweetened baking chocolate broken firmly_packed light_brown sugar unsalted_butter eggs vanilla semisweet_chocolate chips whipping_cream unsalted_butter granulated_sugar semisweet baking chocolate broken,0
academie de cuisine tenderloin of beef,	beef,beef_tenderloin,0
acadian eight bean chili      annie rosenswei,	chili,each of_the following beans kidney white pink black pinto cranberry navy bacon onions peeled_and chopped garlic minced coriander_seeds toasted and ground cinnamon paprika cayenne_pepper to_taste for_the timid tongue dried poblano_chili peppers ground italian tomatoes wjuice beer lean_ground beef salt to_taste,0
acapulco chicken,	poultry	mexican,canned unsalted chicken_broth defatted olive_oil ground_cumin pickling_spice red_bell pepper sliced boneless_skinless chicken_breast halves yellow_bell pepper sliced minced jalapeno_chili with seeds onion halved thinly_sliced rice_wine vinegar fresh_cilantro leaves garlic_cloves minced,0
acapulco chicken enchilada,	poultry,chicken cooked shredded scallions wgreen minced almonds chopped blanched salt enchilada chili_sauce fresh corn_tortillas sour_cream shredded_cheddar cheese sliced ripe_olives sour_cream and scallions vegetable_oil onion chopped green_bell pepper chopped garlic_clove minced tomato_paste water chili_powder or_more salt dried_oregano,0
acapulco sunrise,	mexican	beverages	alcoholic	dkuhnen msn	alcohol,tequila lime_juice curacao creme_de cassis club_soda lime slice to_garnish,0
acceptable emergency substitutions,	hints/info,cinnamon nutmeg ground cloves chervil chives tarragon parsley soy_sauce mashed anchovies ground_cinnamon ground cloves fennel_seed star_anise szechwan_peppercorns oregano marjoram thyme basil rosemary sage cinnamon ground_ginger ground_nutmeg ground_mace ground cloves granulated_sugar superfine_sugar ground_cinnamon dates prunes dried_apricots lemon_juice tomato_paste water rice_vinegar or_hite wine_vinegar sugar salt,0
accra saltfish cakes,	trinidad	appetizers	fish	upload,active_dry yeast water warm _lb codfish salt boneless flour allpurpose sugar granulated onions finely_chopped garlic_cloves chopped_fine pepper hot seeded chopped_fine chives chopped_fine salt to_taste pepper black to_taste oil vegetable,0
aceite o manteca de achiote annato oil or la,	caribbean	condiments	upload,oil vegetable annatto_seeds,0
aceitunas rellenas stuffed olives,	appetizers	mexican,can pitted_olives can anchovy_fillets cut_in small_pieces can chopped pimentos clove_garlic mashed pressed wine_vinegar olive_oil oil from anchovies minced parsley,0
achara zuke turnips in vinegar dressing,	side dish	vegetables,white turnips salt dried red_pepper square_kombu washed rice_vinegar white_vinegar sugar soy_sauce,0
achiote marinade  barbecue sauce for beef,	other sauce,stephen_ceideburg red_wine vinegar water ground_cumin garlic_cloves minced achiote_paste crushed_red pepper salt and black_pepper to_taste olive_oil dried_pasilla chile boiling_water achiote_paste olive_oil of_the marinade,0
ackee codfish,	kaz,tin _lb salted cod fish onion chopped black_pepper to_taste ackee,0
acorn  squash,	kaz,acorn brown_sugar sausage squash,0
acorn bread,	native amer	breads,acorn meal flour baking_powder salt sugar egg beaten milk oil,0
acorn squash  apple soup,	soups	low-cal,med acorn_squash degreased chicken_stock tart green apples chopped onion unsweetened_apple juice grated peeled fresh_ginger salt fresh lemon_juice freshly_ground white pepper plain_non lowfat_yogurt snipped_fresh chives shredded fresh_basil,0
acorn squash  wild rice,,acorn_squash _lb small brussels_sprouts olive_oil diced onion fennel_seeds dried_marjoram minced fresh_sage fresh orange_juice fresh lemon_juice freshly_grated pepper cooked_wild rice,0
acorn squash  wild rice plhol,	grains,acorn_squash _lb small brussels_sprouts olive_oil diced onion fennel_seeds dried_marjoram minced fresh_sage fresh orange_juice fresh lemon_juice freshly_grated pepper cooked_wild rice,0
acorn squash bake,	side dish	white wine,acorn_squash cut_in half butter_or margarine honey salt dry_white wine,0
acorn squash in roasted apples,	new text im	tvfn	tvfn-chef d,acorn_squash peeled_and chopped pippin_apples cut_in half_horizontally chicken_stock butter brown_sugar heavy_cream walnut oil cinnamon ground_ginger,0
acorn squash rings,	vegetables,acorn_squash unsweetened orange_juice firmly_packed brown_sugar brown_sugar twin equal light_corn syrup oleo grated_lemon rind,0
acorn squash rings cranberries  apples,	vegetables	christmas,squash acorn butter cranberries sugar brown packed apple finely_chopped cornstarch water cold,0
acorn squash soup,	soups,acorn_squash carrots sliced onion sliced water butter allpurpose_flour salt tsp pepper chicken_broth sherry ground_nutmeg paprika ground_allspice red_pepper halfandhalf sherry optional,0
acorn squash stuffed apple couscous,	fruits	vegetarian,couscous apple_juice prunes pitted chopped dried_cranberries dried apples apple_juice concentrate thawed cardamom ground maple_syrup acorn_squash halved seeded pecans toasted chopped optional,0
acorn squash cranberry stuffing,	vegetables	lo/no-fat,acorn_squash onion finely_chopped celery_rib finely chopped salt pepper allspice apple cored_and diced apple_juice divided_use cranberries fresh or_rozen raisins brown_sugar bread torn_into pieces nuts coarsely_chopped,0
acorn squash pine nuts,	main dish	vegetarian,acorn_squash halved pine_nuts garlic_clove minced green_onions sliced oil mushrooms sliced zucchini diced yellow_squash diced tomatoes diced lemon_juice oregano basil salt black_pepper,0
acorns,	cookies,butter melted brown_sugar firmly_packed pecans chopped_fine llpurpose_flour sifted baking_powder semisweet_chocolate chips,0
acquasale sweet pepper sauce,	main dish	italian	pasta	appetizers	sauces,olive_oil red onion finely sliced garlic_clove finely minced red_bell peppers roasted ribs membranes seeds removed cut_into slices tomatoes seeded cut_into chunks salt fresh breadcrumbs optional,0
acrats de morue catfish fritters,	martinique	fish	appetizers	upload,flour allpurpose salt eggs butter unsalted melted cooled milk whole _lb salt codfish pepper hot seeded scallions chopped_fine garlic_cloves crushed parsley chopped thyme allspice berry ground pepper black to_taste oil vegetable,0
ada french sponge cookies,	cookies	desserts	low-cal,sifted_cake flour baking_powder salt eggs separated almond_extract vanilla_extract sugar,0
adaisavory indian pancakes,	digest	indian,mixture_of dhals long_grained rice salt to_taste,1
adams  favorite  dessert   kolacky,	kaz,unsalted_butter confectioners sugar egg almond_extract vanilla_extract solo fruit filling sifted_flour additional_powdered sugar yolks,0
adapted pickle juice rye,	abm	breads,bread_flour fleischmann active_yeast sour dill brine water warmed degrees crisco sugar salt dry dill_weed med rye_flour caraway_seeds egg room_temp,0
add rotel to your favorite recipes,	info,no_ingredients,0
adobe mexican smoked chili marinade,	marinades,punky smcdf oranges juice_of lime juice_of chipotle_chiles canned chopped garlic finely_chopped oregano crushed cumin_seeds black_pepper wine_vinegar salt,0
adobo mexican smoked chile marinade,	condiments	spices	mexican	marinades,oranges lime canned_chipotle chilies to_taste cloves_garlic dried_oregano cumin_seed black_pepper wine_vinegar salt,0
adobo smoked chile marinade,	marinades,cloves garlic unpeeled dried chiles_anchos stemmed seeded deveined about ounces dried chiles_guajillos stemmed seeded deveined about ounces inch_stick cinnamon about ground clove a_pinch ground black_peppercorns scant ground bay_leaves broken_up cumin_seed ground dried_oregano dried_thyme salt cider_vinegar,0
adobo kang kong,	pork	poultry,vinegar cider garlic crushed black_pepper rock_salt kang kong approximately onion chopped soy_sauce to_taste pork chopped water,0
adobo sauce,	sauces	marinades	mesamexican	lnet,ancho_chiles wiped_clean white_vinegar water olive_oil onions thinly_sliced garlic_cloves sliced ground_cumin chicken_stock brown_sugar orange_juice lemon_juice tomato_paste black_pepper freshly_ground,0
adobong isda fish in tangy sauce,	fish,hito catfish dressed pickerel trout cloves_garlic crushed vinegar water salt pepper bay_leaf cooking_oil,0
adobong pusit,	seafood,small fresh_squids native_vinegar cloves_garlic salt and pepper_to taste mediumsized onion sliced mediumsized tomatoes chopp salt and pepper for seasonin vetsin monosodium glutamat,0
adolf freys pike quenelles,	fish	german,pike skinned boned water allpurpose_flour eggs butter unsalted salt fresh ground pepper eggs yolks chicken_stock hmmade can heavy_cream salt fresh ground pepper shredded parmesan_cheese,0
aduki  squash soup,	vegetarian	soups/stews,dried aduki_beans butternut_squash water onions chopped carrots sliced balsamic_vinegar bay_leaves dried_savory sprig_fresh rosemary or_ried rosemary barley_miso,0
aduki beans,	kaz,aduki_beans water strip_kombu seaweed tsp sea_salt,0
advocaat  dutch eggnog,	ethnic	beverages	alcohol,eggs level_teaspoon salt sugar cognac level_teaspoons vanilla_essence extract i_think,0
advokaat,	drinks	alcohol,sugar vanilla sugar milk egg_yolks grain_alcohol percent,0
ae mono spinach sesame dressing,	japanese	salads,fresh_spinach stemmed toasted_sesame seeds japanese_soy sauce mirin_or dry_sherry sugar fresh flowers opp garnish,0
aebleskiver danish pancake balls,	danish,flour sugar salt optional baking_powder eggs separated cream milk,0
aebleskivers,	pastry	danish,egg separated buttermilk sugar salt flour baking_powder baking_soda cardamom,0
aelplermagronen the alpine farmers macaroni,	extras	pastas	cheese/eggs,potatoes onions butter clove_garlic mashed whipping_cream macaroni cooked salt freshly_ground pepper gruyere_cheese vacherin fribourg cheese cooking_apples lbs clove vanilla_bean slit_open granulated_sugar stick_cinnamon water lemon_juice optional,0
aelplermagronen the alpine farmers macaroni,	extras	pastas	cheese/eggs,potatoes onions butter clove_garlic mashed whipping_cream macaroni cooked salt freshly_ground pepper gruyere_cheese vacherin fribourg cheese cooking_apples lbs clove vanilla_bean slit_open granulated_sugar stick_cinnamon water lemon_juice optional,0
afelia braised pork coriander,	pork	ethnic,karen_mintzias pork_fillet leg loin butter new_potatoes peeled small mushrooms red_wine salt freshly_ground black_pepper crushed coriander_seeds,0
afghan chicken,	poultry,stephen_ceideburg cloves_garlic salt plain wholemilk yogurt juice and pulp large lemon tablespoons cracked_black pepper whole chicken_breasts about pounds,0
african  chow  mein,	kaz,ground_beef chopped onion chopped celery,0
african green pepper  spinach,	vegetables,onion chopped green pepper chopped oil tomato chopped fresh_spinach stems_removed salt pepper peanut_butter,0
african special curry powder,	spice mix,coriander cumin _lb fenugreek mustard_seeds poppy_seed bay_leaves cardamom cloves peppercorns,0
african squash  yams futari,	vegetables,onion chopped oil hubbard_squash pared and cut_into inch_pieces yams sweet_potatoes pared cut_into pieces coconut_milk salt ground_cinnamon ground cloves,0
african stew curry powder,	spice mix,cumin black_pepper turmeric cloves cinnamon,0
african vegetable curry,	spice mix,coriander dry red_chiles turmeric black_pepper cumin mustard_seeds bengal gram dhal black gram dhal green gram dhal fenugreek,0
after  school  bars,	kaz,crushed graham_crackers melted_butter brown_sugar milk flaked_coconut keebler crackers layer bottom_of pan,0
after holiday ham biscuits,	ham	meats,whole_wheat pastry_flour unbleached_white flour baking_soda cooked_ham diced fine butter milk apple_juice water,0
after-the-holidays  salad,	kaz,diced cooked_turkey pineapple_chunks well drained diced_celery sliced greed onions dry roasted_peanuts seedless_green peppers mayonnaise chopped chutney lime_juice curry_powder salt lettuce_leaves optional,0
afternoon tea sandwiches info,	showers	weddings,info,0
aged tofu figi,	asian	fish/shellf	vegetarian,firm_tofu flour vegetable_oil for_frying water soy tamari sauce sugar honey bottled fish_stock or_egetable stock fresh_ginger root grated fresh scallions chopped,0
aggravation,	mixed drink	scotch	alcohol,scotch kahlua heavy_cream,0
agliata per pasta garlic  walnut sauce fo,	other sauce,stale_bread crusts_removed stock warmed walnuts toasted parsley stems_trimmed garlic_cloves chopped salt black_pepper olive_oil,0
agness mocha velvet pie,	desserts	chocolate	beverages	pies	eggs,inch_pie shell butter sugar square unsweetned chocolate elted vanilla instant_coffee grounds eggs cream for whipping,0
aloo gobi,	vegetarian	indian,cauliflower potatoes oil cumin_seeds ginger fresh garlic_cloves turmeric red chili_powder tomatoes garam_masala coriander powder,1
aloo gobi marks version,	side dish	indian	vegetables	mark's,vegetable_oil potatoes cut_into bite sized_pieces cauliflower cut_into bite sized_pieces asafetida black mustard_seeds whole cumin_seeds piece_ginger grated dried red_chiles bay_leaf coriander powdered turmeric garam_masala salt pepper cilantro minced,1
aloo saag,	side dish	indian	vegetables,oil onion chopped curry_leaves fenugreek_seeds kalonji tomatoes sliced garlic pulp chili_powder coriander salt mango powder potatoes frozen_spinach water red_chiles sliced cilantro chopped pieces ginger shredded,1
cabbage curry,	vegetarian	indian,oil mustard_seeds urad_dal mustard_seeds urad_dal cumin_seeds green chili mixed_vegetables cabbage salt to_taste turmeric,1
cabbage coconut,	side dish	indian	vegetables,oil mustard_seeds green_chiles seeded chopped cabbage finely_shredded turmeric salt sugar coconut fresh grated dry_mustard water,1
calcutta pasta sauce,	seasonings	indian	sauces,butter cumin_seed crushed paprika garlic_cloves minced fresh_ginger root minced jalapenos seeded_and minced chopped fresh canned tomatoes cardamom ground garam_masala plain_yogurt heavy_cream opt for_richer sauce fresh_cilantro chopped,1
omelette pakaki curry spinach  tomato omele,	indian	vegetarian	cheese/eggs	main dish,eggs salt garam_masala butter_or oleo spinach fresh thawed butter_or oleo onion sliced garlic_cloves ginger fresh and chopped green_chilies optional cumin ground tomatoes large and chopped water coriander_leaves chopped,1
onion bhaji,	indian	appetizers	vegetarian,onions egg beaten chick_pea flour besan all_purpose flour whole_wheat flour cold_water approx cumin ground cayenne cilantro fresh chopped,1
orange  currant pilaf,	side dish	indian	rice	fruits,oil onion finely_chopped basmati_rice currants orange_zest finely_shredded ginger finely_chopped water salt,1
orange red pepper radish  red onion sala,	indian	salads,stephen_ceideburg head_romaine lettuce cut_into thin_shreds sweet juicy orange cut_into small_pieces radishes sliced cut_into coarse chunks red_bell pepper cut_into rings small strips red onion sliced very_thinly olive_oil to_taste lemonlime juice to_taste salt to_taste cumin to_taste cayenne_pepper harissa to_taste,1
kashmiri meatballs kashmiri koftas,	indian,ground lamb piece_fresh ginger about inches_long and inch_thick peeled_and finely grated ground_cumin seeds ground_coriander seeds ground cloves ground_cinnamon grated_nutmeg freshly_ground black_pepper cayenne_pepper salt plain_yoghurt vegetable_oil inch_stick cinnamon whole cardamom_pods bay_leaves whole_cloves warm_water,1
kathi roll of nizam,	indian	breads,flour all_purpose salt potatoes boiled peeled mashed coriander_leaves onion finely_chopped green chili seeded chopped warm_water for_kneading ghee oil_for shallow_frying,1
keema matar beef peas,	indian	curry	beef,onion_finely chopped peanut_oil cloves_crushed garlic garam_masala ground_ginger ground_turmeric chili_powder ground_beef tomatoes chopped frozen_peas salt to_taste water,1
keema mattar northern india,	herbs	indian	lamb/mutton,ghi onions finely_chopped thick piece_of ginger peeled minced garlic_clove peeledminced whole_cloves cinnamon powdered coriander powdered cumin turmeric salt red_pepper tomato_paste yogurt plain lamb ground peas,1
khatta moong soured lentils,	indian	vegetarian	ceideburg 2,yogurt mung_dal water turmeric ground salt water gram_flour chiles green ginger fresh knob ghee cinnamon_stick cumin whole hing sugar cilantro_leaves chopped,1
kheer [vermicelli pudding],	desserts	indian,stick_butter handful very_fine vermicelli milk whipping_cream handful_raisins sugar almonds optional peeled and thinly_slice,1
khichadi from maja,	indian	grains	side dish	vegetables,basmati_rice moong_dal water raw_cashews raw almonds coconut peas carrots inch_piece cinnamon whole_cloves whole red_chile sugar optional asafetida yellow currants raisins cumin black mustard_seeds parsley cilantro garam_masala,1
kobi-batata shaak,	vegetables	indian,vegetable_oil cumin mustard_seeds potatoes cut_into inch_pieces shredded green_cabbage up_to twice as_much cumin powder coriander powder turmeric powder red chili_powder fresh_cilantro chopped lemon_juice tomatoes chopped,1
kootu,	vegetarian	indian,yellow_split peas chili_powder turmeric spinach egetarian etc urad_dal black_pepper red_chillies cumin_seeds coconut grated,1
kumror bhate,	side dish	indian	bengali	rice	vegetables,mustard oil black mustard_seeds green_chile seeded minced turmeric butternut_squash cooked mashed salt lime_juice rice cooked green_chile slivered,1
caribou curry,	game	caribou	indian	curry	jw,caribou_meat onion chopped inch ginger_root finely_chopped garlic minced pepper_to taste cumin powder tumeric salt to_taste mustard oil water broth,1
carrot halva,	desserts	indian,carrots milk sugar carnation_milk powder oil to_taste nuts,1
cauliflower  potatoes aloo gobi,	vegetables	indian,cauliflower potatoes onion tomato pod garlic inch ginger turmeric to_taste salt to_taste pepper garam_masala,1
cauliflower  potatoes black mustard see,	indian	vegetables,cubed new_potatoes cauliflower black mustard_seeds fenugreek_seeds freshly_ground cumin_seeds turmeric powdered hot red_chile pepper salt peanut_oil minced garlic tomato chopped fresh serrano_chiles chopped chopped cilantro_leaves lemon_juice to_taste,1
cauliflower onion  tomato,	side dish	indian	vegetables,cauliflower broken_into florets onion chopped piece_ginger grated water vegetable_oil garlic_cloves chopped cumin coriander tomatoes peeled chopped turmeric cayenne to_taste fresh green chili chopped lemon_juice salt garam_masala,1
chai kurdi kurdish tea,	beverages	jewish	indian,india tea_leaves cinnamon stick water boiling sugar cubes,1
chapatis,	indian	breads,flour unbleached flour whole_wheat salt ghee water,1
chapatis,	indian	breads,flour unbleached flour whole_wheat salt ghee water,1
chat masala,	sauces	indian,cumin_seeds fennel_seeds garam_masala mango powder black salt cayenne_pepper asafetida powder ground_ginger,1
pakora batter,	vegetarian	indian,chick_pea flour sifted ghee lemon_juice cayenne turmeric garam_masala coriander salt cold_water as_needed baking_powder optional,1
pakoras savory fritters,	appetizers	indian,besan warm_water red_pepper salt garam_masala paprika optional onion potato few spinach_leaves oil_for deep_frying,1
palak tofu-paneer,	main dish	indian	tofu	vegetarian,firm_tofu drained cubed soy_sauce oil_for deepfrying ghee frozen chopped spinach fresh tomatoes cubed ghee curry_powder asafetida ground_cumin ground_coriander cayenne_pepper black_pepper cinnamon allspice cloves soy_sauce,1
palak tomatar spinach  tomatoes,	indian	vegetarian	main dish,spinach fresh thawed tomatoes chopped onion large and chopped turmeric ginger fresh and chopped green_chilies optional water butteroleo salt lemon_juice,1
panch puran,	sauces	indian,cumin_seeds black mustard_seeds fennel_seeds nigella seeds fenugreek_seeds,1
paneer homemade cheese,	indian	cheese,milk vinegar vegetable_oil,1
paneer basmati pilaf--paneer pulao,	indian	rice,stephen_ceideburg basmati_rice paneer see_recipe light vegetable_oil cauliflower_florets diagonally_sliced carrots chopped red green_bell pepper cashew_halves raisins bay_leaves inch_piece cinnamon_stick whole_cloves black_peppercorns water canned tomato_sauce salt,1
paneer patties in orange perfumed cream sauce,	indian	desserts,stephen_ceideburg water tablespoon sugar halfandhalf grated_orange zest allpurpose_flour paneer see_recipe chopped unsalted_pistachios,1
par-cooked balti meat from chapmans balti c,	balti	indian	meats,meat lamb beef pork cut_into inch_cubes weighed_after cubing stock water balti_masala paste,1
paratha,	breads	indian,whole_wheat flour ghee water,1
chholar ghughni,	main dish	indian	bengali	vegetarian,vegetable_oil bay_leaf onion finely_chopped garlic minced ginger minced turmeric cumin ground coriander ground green_chile seeded minced tomatoes chopped salt chick_peas cooked mild raw onion_rings roma_tomatoes chopped cilantro chopped,1
chicken curry dhawan,	indian	poultry,chicken_breast boneless and skinless oil cumin cardamom_seeds thai_chile cloves onion finely_chopped tomato whole peeled ginger paste garlic paste soy_sauce garam_masala chilli_powder pepper water,1
chicken curry north indian style,	indian	poultry,chicken drumsticks thighs breast piece carton_plain yogurt onions very_finely chopped vegetable_oil cloves mustard powder pods_cardamom cumin powder garam_masala chilli_powder inch ginger pods garlic coriander_seeds to_taste salt freshly_ground pepper,1
chicken dopiazza indian chicken curry,	indian	curry	chicken,chicken meat onions thinly_sliced peanut_oil garlic_powder coriander_seeds ground_cumin ground_turmeric ground_ginger chili_powder black_pepper salt tomatoes undrained,1
chicken korma,	poultry	indian,chicken_breast halves boned safflower_oil butter clarified the indians call this stuff ghee yellow_onions cloves_garlic fresh ginger use fresh_ginger if_you can_find cloves whole green cardamom_seeds whole cracked or_less use ground_cardamom bay_leaves salt coriander ground cayenne_pepper or_more to_taste yogurt plain water milk,1
chicken kurma sista,	indian	poultry,stephen_ceideburg cloves cardamom_pods cinnamon_stick coriander_seeds cumin_seeds turmeric cloves_garlic twoinch cube fresh_ginger peeled yogurt salt to_taste pound chicken poppy_seeds cashews blanched_almonds unsweetened shredded_coconut ghee onions finely_chopped fresh green_chiles minced chopped cilantro,1
chicken moglai balti,	indian	poultry	balti,large chicken skinned meat removed and cut_into chunks clarified_butter ghee unsalted_butter onions grated salt inch_piece ginger peeled_and grated garlic_cloves crushed green_cardamoms broken slightly open inch cinnamon_sticks eggs lightly_beaten sugar ground almonds cream flaked_almonds to_garnish,1
chicken tandoori,	indian	chicken,chicken pieces onion minced cloves_garlic chopped fresh chopped ginger natural_yoghurt lemon_rind juice vinegar paprika garam_masala ground_coriander ground_cumin red_food colouring,1
chicken tandoori,	indian	chicken,chicken pieces onion minced cloves_garlic chopped fresh chopped ginger natural_yoghurt lemon_rind juice vinegar paprika garam_masala ground_coriander ground_cumin red_food colouring,1
chicken vindaloo,	poultry	indian,cumin_seeds whole peppercorns black cardamom_seeds cinnamon stick black mustard_seeds whole fenugreek_seeds whole white_wine vinegar salt cayenne_pepper brown_sugar light vegetable_oil yellow_onions peeled_and cut_into halfrings water ginger fresh inch_cube peeled_and coarsely_chopped garlic_cloves peeled_and coarsely_chopped or_less coriander_seeds ground turmeric ground chicken_breast boneless cut_into bitesized_pieces tomato_sauce _lb new_potatoes peeled_and quartered,1
peas potato  eggplant curry,	main dish	indian	vegetables	vegetarian,potatoes eggplant frozen_peas garlic_cloves ginger dried hot_chili chili_powder onion turmeric powder vegetable_oil salt to_taste,1
phaalse ka sharbat blackberry downpour,	beverages	indian	vegetarian,blackberries water raw sugar to_taste sea_salt small pinch crushed_ice to_serve pineapple_slices to_garnish,1
pheasant curry india,	game	indian,pheasantsdisjointed coriander cumin sesame_seeds turmeric chili_peppers water ginger salt butter onionssliced,1
chickpea curry,	main dish	indian	vegetarian,cooked_chickpeas onions dried red_chilies ginger garlic_cloves mustard powder cumin turmeric cinnamon vegetable_oil salt to_taste tomato,1
chilie tomato salad,	salads	appetizers	indian	vegetarian,tomatoes parsley chopped hot green chili chopped olive_oil lemon_juice salt pepper cayenne,1
pistachio kulfi pops,	indian	ice cream	ethnic	desserts,whole milk sugar shelled roasted_pistachios paper_cups or_ooking parchment axed paper ice_cream sticks opt,1
pork vindaloo,	indian	pork,lean_pork oil mustard vinegar green_chillies chopped halfinch cube_ginger chopped turmeric salt sprig_curry leaves spices ground together red_chillies garlic halfinch cube_ginger white cummin mustard onion inch stick_cinnamon cloves,1
potato  onion koora,	indian	vegetables	ceideburg,stephen_ceideburg potatoes peeled turmeric corn oil chana_dal urad_dal dried red_chiles broken_into pieces by_hand mustard_seeds oneinch_cube fresh_ginger peeled_and minced fresh green_chiles minced onion thinly_sliced salt to_taste fresh lemon_juice,1
potato chops alu ki tikiya  vegan,	indian	appetizers	nibbles	side dish	potatoes,potatoes boiled mashed salt garam_masala ground_cumin and ground_coriander chopped fresh_coriander cilantro onion very_finely chopped green_chillies finely chopped grated fresh_ginger root oil spray for cooking,1
